{
  "schema_version": "aicx.answer_submission.v0",
  "submission_id": "SUB-QUIZ-ASB-2026-06-22-SLACK-REPLY-FIXTURE",
  "quiz_set_id": "QUIZ-ASB-2026-06-22",
  "submitted_for_date": "2026-06-22",
  "source": "slack_reply_fixture_grading",
  "source_event_id": "SLACKREPLY-QUIZ-ASB-2026-06-22-FIXTURE",
  "answers": [
    {
      "question_id": "QB-ASB-BRANCHING-001",
      "selected_choice": "A"
    },
    {
      "question_id": "QB-ASB-BRANCHING-002",
      "selected_choice": "B"
    },
    {
      "question_id": "QB-ASB-WORKFLOW-001",
      "selected_choice": "B"
    },
    {
      "question_id": "QB-ASB-WORKFLOW-002",
      "selected_choice": "C"
    },
    {
      "question_id": "QB-ASB-ORG-KPI-001",
      "selected_choice": "C"
    },
    {
      "question_id": "QB-ASB-ORG-KPI-002",
      "selected_choice": "C"
    },
    {
      "question_id": "QB-ASB-GOVERNANCE-001",
      "selected_choice": "B"
    },
    {
      "question_id": "QB-ASB-GOVERNANCE-002",
      "selected_choice": "B"
    },
    {
      "question_id": "QB-ASB-5D-001",
      "selected_choice": "B"
    },
    {
      "question_id": "QB-ASB-5D-002",
      "selected_choice": "C"
    }
  ]
}
